{
  "schema_version": "UCKK-ATLAS-0.2-draft",
  "voie_id": "voie_sciences_politiques",
  "code": "SP",
  "nom": "Voie des Sciences politiques",
  "domaine_operatoire": "Pouvoir et gouvernance civique",
  "niveau_vise": "Puissance opératoire",
  "titre_interne_vise": "Mage UCKK en Sciences politiques",
  "titre_symbolique": "Stratège civique",
  "parchemin": "Parchemin de Puissance opératoire — Voie des Sciences politiques",
  "statut": "Voie fondatrice UCKK",
  "definition_courte": "La Voie des Sciences politiques forme des personnes capables de lire, analyser et réformer les mécanismes du pouvoir, de la légitimité, de la décision collective et de la gouvernance civique.",
  "angle_fondamental": "Comprendre le pouvoir comme architecture de règles, d'institutions, de récits, de décisions, de conflits, de contre-pouvoirs et de légitimité dans le Grand Jeu social.",
  "competence_centrale": "Analyser les systèmes politiques, diagnostiquer leurs dérives et concevoir des mécanismes de décision plus légitimes, auditables et responsables.",
  "seuils_progression": [
    {
      "seuil_id": "fondations_politiques",
      "nom": "Fondations politiques",
      "fonction": "Comprendre le pouvoir, l'autorité, la légitimité, l'État, les institutions, les droits et la citoyenneté."
    },
    {
      "seuil_id": "mecanismes_collectifs",
      "nom": "Mécanismes collectifs",
      "fonction": "Analyser démocratie, élections, assemblées, acteurs politiques, mouvements sociaux, médias et opinion publique."
    },
    {
      "seuil_id": "reforme_gouvernance",
      "nom": "Réforme et gouvernance",
      "fonction": "Diagnostiquer capture, corruption, conflits, infrastructures numériques et concevoir des contre-pouvoirs ou réformes institutionnelles."
    }
  ],
  "cours_conceptuels": [
    {
      "cours_id": "SP101",
      "ordre": 1,
      "nom": "Pouvoir, autorité et légitimité",
      "concept_maitre": {
        "concept_id": "sp_pouvoir_legitimite",
        "nom": "Pouvoir et légitimité",
        "definition_courte": "Les conditions par lesquelles un pouvoir agit, se fait reconnaître, se fait obéir ou se trouve contesté.",
        "fonction_pedagogique": "Donner les fondations conceptuelles permettant de distinguer pouvoir, autorité, domination, consentement et légitimité.",
        "type": "concept_maitre"
      },
      "concepts_associes": [
        {
          "concept_id": "sp_pouvoir",
          "nom": "Pouvoir",
          "type": "concept_associe",
          "definition_courte": "Capacité d'orienter, contraindre ou rendre possibles les actions d'autrui.",
          "role_dans_le_concept_maitre": "Concept central permettant de lire toute relation politique.",
          "notions_fines": []
        },
        {
          "concept_id": "sp_autorite",
          "nom": "Autorité",
          "type": "concept_associe",
          "definition_courte": "Pouvoir reconnu comme légitime ou acceptable par ceux qui y sont soumis.",
          "role_dans_le_concept_maitre": "Permet de distinguer commandement reconnu et domination imposée.",
          "notions_fines": []
        },
        {
          "concept_id": "sp_domination",
          "nom": "Domination",
          "type": "concept_associe",
          "definition_courte": "Relation durable d'asymétrie où un acteur ou un groupe impose sa volonté à d'autres.",
          "role_dans_le_concept_maitre": "Rend visibles les formes stables et structurelles du pouvoir.",
          "notions_fines": []
        },
        {
          "concept_id": "sp_consentement",
          "nom": "Consentement",
          "type": "concept_associe",
          "definition_courte": "Acceptation explicite ou implicite d'une autorité, d'une règle ou d'un ordre politique.",
          "role_dans_le_concept_maitre": "Permet d'analyser ce qui distingue obéissance libre, contrainte et résignation.",
          "notions_fines": []
        },
        {
          "concept_id": "sp_coercition",
          "nom": "Coercition",
          "type": "concept_associe",
          "definition_courte": "Usage ou menace de la force, de la sanction ou de la contrainte pour obtenir un comportement.",
          "role_dans_le_concept_maitre": "Montre la limite entre autorité acceptée et contrainte imposée.",
          "notions_fines": []
        },
        {
          "concept_id": "sp_influence",
          "nom": "Influence",
          "type": "concept_associe",
          "definition_courte": "Capacité de modifier les perceptions, préférences ou décisions sans contrainte directe.",
          "role_dans_le_concept_maitre": "Permet de lire les pouvoirs diffus, symboliques et médiatiques.",
          "notions_fines": []
        },
        {
          "concept_id": "sp_obeissance",
          "nom": "Obéissance",
          "type": "concept_associe",
          "definition_courte": "Fait de se conformer à une règle, un ordre ou une autorité.",
          "role_dans_le_concept_maitre": "Permet d'étudier pourquoi les individus suivent les règles ou les ordres.",
          "notions_fines": []
        },
        {
          "concept_id": "sp_resistance",
          "nom": "Résistance",
          "type": "concept_associe",
          "definition_courte": "Action de refus, opposition ou contournement d'un pouvoir jugé abusif ou illégitime.",
          "role_dans_le_concept_maitre": "Montre que le pouvoir produit aussi des contre-forces.",
          "notions_fines": []
        },
        {
          "concept_id": "sp_souverainete",
          "nom": "Souveraineté",
          "type": "concept_associe",
          "definition_courte": "Capacité ultime de décider dans un territoire, une institution ou une communauté politique.",
          "role_dans_le_concept_maitre": "Permet de comprendre qui détient l'autorité finale dans un ordre politique.",
          "notions_fines": []
        },
        {
          "concept_id": "sp_mandat",
          "nom": "Mandat",
          "type": "concept_associe",
          "definition_courte": "Autorisation confiée à une personne ou institution pour agir au nom d'un collectif.",
          "role_dans_le_concept_maitre": "Relie légitimité, représentation et responsabilité politique.",
          "notions_fines": []
        },
        {
          "concept_id": "sp_confiance_publique",
          "nom": "Confiance publique",
          "type": "concept_associe",
          "definition_courte": "Crédit accordé par une population à ses institutions, dirigeants ou procédures.",
          "role_dans_le_concept_maitre": "Permet d'évaluer la solidité symbolique et pratique d'un pouvoir.",
          "notions_fines": []
        },
        {
          "concept_id": "sp_crise_legitimite",
          "nom": "Crise de légitimité",
          "type": "concept_associe",
          "definition_courte": "Moment où une autorité continue d'exister mais n'est plus reconnue comme juste, crédible ou acceptable.",
          "role_dans_le_concept_maitre": "Permet d'étudier les ruptures politiques, institutionnelles et sociales.",
          "notions_fines": []
        }
      ],
      "artefact_maitrise": {
        "type": "carte_de_pouvoir",
        "nom": "Carte d'un système de pouvoir",
        "description": "Cartographier une relation de pouvoir réelle en distinguant autorité, domination, consentement, coercition, résistance et sources de légitimité."
      },
      "criteres_passage": [
        "Distinguer pouvoir, autorité, domination et légitimité.",
        "Identifier les sources d'obéissance et de résistance.",
        "Analyser une crise de légitimité à partir d'un cas concret."
      ],
      "relations": []
    },
    {
      "cours_id": "SP102",
      "ordre": 2,
      "nom": "État, constitution et institutions publiques",
      "concept_maitre": {
        "concept_id": "sp_etat_institutions",
        "nom": "Architecture institutionnelle du pouvoir",
        "definition_courte": "Organisation officielle des pouvoirs, règles, fonctions et institutions qui structurent une communauté politique.",
        "fonction_pedagogique": "Comprendre comment l'État, la constitution et les institutions publiques organisent la décision collective.",
        "type": "concept_maitre"
      },
      "concepts_associes": [
        {
          "concept_id": "sp_etat",
          "nom": "État",
          "type": "concept_associe",
          "definition_courte": "Institution politique qui revendique l'autorité publique sur un territoire et une population.",
          "role_dans_le_concept_maitre": "Point d'entrée pour comprendre l'organisation moderne du pouvoir.",
          "notions_fines": []
        },
        {
          "concept_id": "sp_gouvernement",
          "nom": "Gouvernement",
          "type": "concept_associe",
          "definition_courte": "Ensemble des personnes et organes qui dirigent l'action publique.",
          "role_dans_le_concept_maitre": "Permet de distinguer l'État durable du pouvoir exécutif temporaire.",
          "notions_fines": []
        },
        {
          "concept_id": "sp_constitution",
          "nom": "Constitution",
          "type": "concept_associe",
          "definition_courte": "Texte ou ensemble de règles fondamentales organisant les pouvoirs et les droits.",
          "role_dans_le_concept_maitre": "Définit le cadre supérieur de l'autorité politique.",
          "notions_fines": []
        },
        {
          "concept_id": "sp_separation_pouvoirs",
          "nom": "Séparation des pouvoirs",
          "type": "concept_associe",
          "definition_courte": "Principe répartissant les fonctions législative, exécutive et judiciaire pour limiter les abus.",
          "role_dans_le_concept_maitre": "Montre comment l'architecture institutionnelle crée des contrepoids.",
          "notions_fines": []
        },
        {
          "concept_id": "sp_executif",
          "nom": "Pouvoir exécutif",
          "type": "concept_associe",